PMID,Title,Abstract,Date,Entities,Countries
40726513,"Characterization of Lumpy Skin Disease in Northern Bangladesh: Clinical, Pathological, Biochemical, and Molecular Perspectives.","Lumpy skin disease (LSD) is an economically important disease of cattle, considered as a threat to the livestock industry. This study aimed to assess the clinical symptoms, gross pathology and histopathology, serum biochemical values, and molecular characterization of LSD in cattle. Cattle in Dinajpur, Thakurgaon, Nilphamari, and Rangpur affected by LSD were initially diagnosed through clinical signs and gross lesions. Blood samples were then collected for biochemical analysis and molecular detection through PCR, and sequencing was performed to characterize the LSD virus (LSDV). The prevalence of LSD in northern areas of Bangladesh was 33.44%. The recorded clinical signs were high fever; firm, raised skin nodules around the head, neck, and limbs; swelling of the limbs and brisket area; and rough hair coat, nasal discharge, dyspnea, corneal opacity, and severe weakness. Grossly, a well-defined, hard swelling of around 1-3.00 cm in diameter in the skin accompanied enlargement of the nearby lymph nodes, and the nodules are composed of a hard, creamy-gray, or yellow clump of the tissue. Histopathologically, ballooning degeneration of the epidermal cell layers, intracytoplasmic eosinophilic inclusion bodies in distinct dermal and epidermal cells, necrosis with substantial infiltration of inflammatory cells, and congested blood vessels in the dermal layer were noted. While total protein, BUN, serum AST, and ALT were increased significantly (p < 0.05), the serum creatinine, GGT, and total albumin were not changed significantly compared with the healthy cattle. Phylogenetic analysis showed that the circulating isolates from northern part of Bangladesh were found in the same clades with India, Pakistan, and Thailand. Thus, this study provides crucial findings on this emerging disease, including its gross and histopathology, serum biochemical properties, and molecular epidemiology in the northern regions of Bangladesh.",2025,"['lumpy skin disease', 'lsd', 'disease', 'cattle', 'threat', 'livestock industry', 'study', 'assess', 'clinical symptoms', 'gross pathology', 'histopathology', 'serum', 'biochemical values', 'molecular characterization', 'lsd', 'cattle', 'cattle', 'dinajpur', 'thakurgaon', 'nilphamari', 'rangpur', 'affected', 'lsd', 'diagnosed', 'clinical signs', 'gross lesions', 'blood samples', 'biochemical analysis', 'molecular detection', 'pcr', 'sequencing', 'lsd virus', 'lsdv', 'prevalence', 'lsd', 'northern areas', 'bangladesh', 'clinical signs', 'fever', 'skin nodules', 'head', 'neck', 'limbs', 'swelling', 'limbs', 'brisket area', 'rough hair coat', 'nasal discharge', 'dyspnea', 'corneal opacity', 'severe weakness', 'grossly', 'well-defined', 'hard swelling', 'diameter', 'skin', 'enlargement', 'nearby lymph nodes', 'nodules', 'hard', 'creamy-gray', 'yellow clump', 'tissue', 'histopathologically', 'ballooning degeneration', 'epidermal cell', 'intracytoplasmic eosinophilic inclusion bodies', 'dermal', 'epidermal cells', 'necrosis', 'inflammatory cells', 'congested blood vessels', 'dermal layer', 'bun', 'serum ast', 'alt', 'increased', 'serum creatinine', 'ggt', 'albumin', 'healthy', 'cattle', 'phylogenetic analysis', 'circulating', 'isolates', 'northern', 'bangladesh', 'clades', 'india', 'pakistan', 'thailand', 'study', 'findings', 'disease', 'gross', 'histopathology', 'serum', 'biochemical', 'properties', 'molecular epidemiology', 'northern regions', 'bangladesh']","['Bangladesh', 'India', 'Pakistan', 'Thailand']"
40721454,"Clinical, laboratory, radiological features, and outcome of acute fat embolism syndrome in sickle cell disease.","Non-traumatic fat embolism syndrome (FES) affecting brain, lung and hematopoietic system is a rare, but a serious complication of sickle cell disease (SCD), resulting from bone marrow necrosis. SCD-related FES is rare, with the spectrum of clinical, laboratory, radiological manifestations and patient outcome is not fully understood. After medical research & ethics committee approval, retrospectively, SCD-FES patients at our centre, were reviewed between January 2006 to December 2023. 27 patients (17 males, 10 females) with a median age of 24 years and length of hospital stay of 24 (16-38) days were enrolled. They had fever, chest/back pain, cough and crepitation in 100%, 96%, 56% and 100% respectively, with neurological manifestations in 96%. Abnormal chest X-rays and CT scans were observed in 96%, and 100% respectively. Patients had significant anemia, reticulocytopenia, and thrombocytopenia, with raised WBC (p < 0.05). There was a significant rise in LDH, ALP, Ferritin and C-reactive protein levels. All patients received antibiotics, and exchange transfusions, whereas 24%, 76% required non-invasive ventilation (NIV) and mechanical ventilation respectively, with 18.5% mortality. FES is a rapidly progressive respiratory and neurological syndrome, characterized by hypoxia, and cytopenia, with raised inflammatory markers, raised LDH and ALP, with distinctive multiple cerebral microbleeds.",2025 Jul 28,"['non-traumatic fat embolism syndrome', 'fes', 'brain', 'lung', 'hematopoietic system', 'rare', 'complication', 'sickle cell disease', 'scd', 'bone marrow necrosis', 'scd-related', 'fes', 'rare', 'spectrum', 'clinical', 'laboratory', 'radiological manifestations', 'patient outcome', 'medical research', 'ethics committee', 'approval', 'retrospectively', 'scd-fes', 'patients', 'centre', 'reviewed', 'patients', 'males', 'females', 'age', 'years', 'length of hospital stay', 'days', 'fever', 'chest/back pain', 'cough', 'crepitation', 'neurological manifestations', 'abnormal', 'x-rays', 'ct scans', 'patients', 'anemia', 'reticulocytopenia', 'thrombocytopenia', 'wbc', 'ldh', 'alp', 'ferritin', 'c-reactive protein levels', 'patients', 'antibiotics', 'exchange transfusions', 'non-invasive ventilation', 'niv', 'mechanical ventilation', 'mortality', 'fes', 'progressive', 'respiratory', 'neurological syndrome', 'hypoxia', 'cytopenia', 'inflammatory', 'markers', 'ldh', 'alp']",[]
40720729,PFAPA meets Behcet's Disease: A Rare Overlap in a Pediatric Patient.,"Periodic Fever, Aphthous Stomatitis, Pharyngitis, and Cervical Adenitis (PFAPA) syndrome and Behcet's Disease (BD) are autoinflammatory disorders with overlapping features, including recurrent oral ulcers and systemic inflammation. PFAPA predominantly affects young children with periodic fever episodes, while BD is rare in pediatrics and presents with mucocutaneous and systemic involvement. This case of an 8-year-old boy with features of both conditions highlights diagnostic challenges and the potential for shared pathogenic mechanisms.",2025 Jul 26,"['periodic fever', 'aphthous stomatitis', 'pharyngitis', 'cervical adenitis', ""behcet's disease"", 'autoinflammatory disorders', 'features', 'recurrent', 'oral ulcers', 'systemic inflammation', 'pfapa', 'young', 'children', 'periodic fever', 'episodes', 'pediatrics', 'mucocutaneous', 'systemic', 'involvement', '8-year-old', 'boy', 'features', 'conditions', 'diagnostic', 'potential', 'pathogenic', 'mechanisms']",[]
40717932,Acute Pancreatitis Associated with Scrub Typhus: Report of two cases with a brief review of literature.,"Acute pancreatitis is an exceptionally rare complication of scrub typhus. We report 2 cases of scrub typhus-associated acute pancreatitis from a tertiary care centre in Kolkata, India. The first case was a 27-year-old male patient, who presented in 2023, with severe epigastric pain a few days after the onset of fever. Laboratory investigations confirmed acute pancreatitis associated with scrub typhus. He had no additional organ involvement and recovered fully with intravenous doxycycline. The second case, reported in 2024, was a 42-year-old female patient who presented with fever, abdominal pain, vomiting and systemic complications, including acute kidney injury, hepatic dysfunction and pulmonary involvement. Despite the absence of eschar, investigations confirmed the diagnosis of scrub typhus. She achieved full recovery with doxycycline, haemodialysis and other supportive measures. Both cases emphasise the importance of considering scrub typhus in the differential diagnosis of acute pancreatitis in endemic regions, particularly when accompanied by febrile illness.",2025,"['acute pancreatitis', 'complication', 'scrub typhus', 'cases', 'scrub', 'typhus-associated acute pancreatitis', 'tertiary care centre', 'kolkata', 'india', 'case', 'male', 'patient', 'severe', 'epigastric pain', 'days', 'fever', 'laboratory investigations', 'acute pancreatitis', 'associated with', 'scrub typhus', 'organ', 'involvement', 'recovered', 'intravenous', 'doxycycline', 'case', 'female', 'patient', 'fever', 'abdominal pain', 'vomiting', 'systemic complications', 'acute kidney injury', 'hepatic dysfunction', 'pulmonary involvement', 'absence', 'eschar', 'investigations', 'diagnosis', 'scrub typhus', 'recovery', 'doxycycline', 'haemodialysis', 'supportive measures', 'cases', 'scrub', 'differential diagnosis', 'acute pancreatitis', 'endemic regions', 'febrile illness']",['India']
40717684,Detecting early markers of sepsis in paediatric patient with prolonged cardiopulmonary bypass time.,"BACKGROUND: Sepsis, a life-threatening organ dysfunction resulting from a dysregulated host response to infections, poses a critical threat. Cardiac surgery itself induces a robust inflammatory response, further exacerbated by cardiopulmonary bypass, causing notable clinical and physiological changes. Identifying sepsis early in the post-operative period with elevated septic markers becomes challenging, with delayed antibiotic intervention ultimately posing a fatal risk for the patient. METHODS: We performed a prospective observational cross-sectional study aimed at identifying sepsis markers that include total leucocyte count, absolute neutrophil count, platelet count, serum albumin, chest X-ray, blood, urine, and tracheal cultures, procalcitonin, c-reactive protein, serum lactate >2.5 mmol/l along with clinical parameters (fever, hypotension, tachycardia) on post-operative days 1, 3, 5, and 10 in paediatric patients undergoing cardiac surgery with prolonged cardiopulmonary bypass time >100 min. RESULTS: Total leucocyte count, absolute neutrophil count, and platelet counts were not significant enough to detect early sepsis, especially in patients with prolonged cardiopulmonary bypass time. Chest X-ray was significant from post-operative day 3 onwards. Procalcitonin was significant from day 5, and C-reactive protein was significant only from day 10. Among the clinical parameters, fever, hypotension, tachycardia, and elevated lactate levels were significant from post-operative day 1 in the patients developing sepsis. CONCLUSION: Neonates and infants faced a higher sepsis risk than older children. Longer cardiopulmonary bypass and aortic clamp times correlated with increased sepsis likelihood. Clinical factors outweighed laboratory indicators for early sepsis detection post-cardiac surgery, prompting prompt investigation and intervention.",2025 Jul 28,"['background', 'sepsis', 'life-threatening', 'organ dysfunction', 'dysregulated', 'host', 'infections', 'cardiac surgery', 'induces', 'inflammatory response', 'exacerbated', 'cardiopulmonary bypass', 'clinical', 'physiological', 'sepsis', 'early', 'post-operative', 'period', 'elevated', 'septic markers', 'delayed', 'antibiotic', 'intervention', 'fatal', 'risk', 'patient', 'cross-sectional study', 'sepsis', 'markers', 'absolute', 'neutrophil', 'platelet count', 'serum albumin', 'chest x-ray', 'blood', 'urine', 'tracheal cultures', 'procalcitonin', 'c-reactive protein', 'serum lactate', 'clinical', 'parameters', 'fever', 'hypotension', 'tachycardia', 'post-operative', 'days', 'paediatric patients', 'cardiac surgery', 'prolonged', 'cardiopulmonary bypass time', 'total leucocyte count', 'absolute', 'neutrophil', 'platelet counts', 'detect', 'sepsis', 'patients', 'prolonged', 'cardiopulmonary bypass time', 'chest x-ray', 'post-operative', 'day', 'onwards', 'procalcitonin', 'day', 'c-reactive protein', 'day', 'clinical', 'parameters', 'fever', 'hypotension', 'tachycardia', 'elevated', 'post-operative', 'day', 'patients', 'sepsis', 'neonates', 'infants', 'sepsis', 'risk', 'older children', 'cardiopulmonary bypass', 'aortic clamp times', 'correlated', 'increased', 'sepsis', 'likelihood', 'clinical factors', 'laboratory indicators', 'sepsis', 'detection', 'post-cardiac surgery', 'investigation', 'intervention']",[]
40717293,EP Rounds: Incessant Wide QRS Tachycardia in a Young Man With Dyspnea and Fever.,,2025 Jul 27,[],[]
40715741,New insights on pharmacological potential of montelukast: a comprehensive review.,"Leukotrienes are strong lipid mediators that mainly act through particular leukotriene receptors to produce a broad range of clinical effects. These receptors facilitate the complex biochemical and physiological responses associated with leukotrienes. An examination of their roles in various diseases reveals the pharmacological effects of anti-leukotriene agents, specifically their ability to modulate inflammatory responses within the body. Recent research has focused on the dual nature of these lipids, revealing that they may trigger a mild inflammatory response, which is a key significant factor in neurological diseases, cardiovascular diseases, metabolic syndromes, renal difficulties, liver damage, and cancer. Among the available modulators, Montelukast is distinguished as a particularly effective orally active leukotriene receptor antagonist. In the United States and around the world, it has been available and generally approved for the treatment of hay fever and asthma for more than 11 years. It is frequently recommended as an adjuvant to low-dose inhaled corticosteroids for patients who need additional medication, or as an alternative first-line treatment for pediatric asthma, even in cases with mild, persistent symptoms. Apart from anti-asthmatic and anti-allergic activities, Montelukast has numerous pharmacological activities such as anticancer, neuroprotective, anti-osteoporotic, renal protective, liver protective, cardioprotective, anti-arthritic effects, and other beneficial effects on the body. Montelukast operates through a highly effective mechanism that makes it a potent ally in the battle against various respiratory conditions, including asthma and hay fever.",2025 Jul 26,"['leukotrienes', 'lipid mediators', 'leukotriene receptors', 'clinical effects', 'receptors', 'complex', 'biochemical', 'physiological responses', 'associated with', 'leukotrienes', 'examination', 'diseases', 'pharmacological', 'anti-leukotriene agents', 'modulate', 'inflammatory responses', 'body', 'research', 'nature', 'lipids', 'mild', 'inflammatory response', 'neurological diseases', 'cardiovascular diseases', 'metabolic syndromes', 'renal difficulties', 'liver damage', 'cancer', 'modulators', 'montelukast', 'effective', 'orally', 'leukotriene receptor antagonist', 'united states', 'world', 'treatment', 'hay fever', 'asthma', 'years', 'adjuvant', 'low-dose', 'inhaled corticosteroids', 'patients', 'medication', 'alternative', 'first-line treatment', 'pediatric asthma', 'cases', 'mild', 'persistent', 'symptoms', 'anti-asthmatic', 'anti-allergic activities', 'montelukast', 'pharmacological activities', 'anticancer', 'neuroprotective', 'anti-osteoporotic', 'renal', 'liver', 'cardioprotective', 'anti-arthritic effects', 'effects', 'body', 'montelukast', 'operates', 'effective', 'mechanism', 'battle', 'respiratory conditions', 'asthma', 'hay fever']",['United States']
40715601,"Identification of potential VP40 inhibitor of Marburg virus through molecular docking, pharmacokinetic analysis and molecular dynamics simulation.","West Africa has been experiencing a resurgence of Marburg virus disease (MVD), a zoonotic pathogen that causes severe hemorrhagic fever in both humans and primates. Regretfully, there are not any effective medications on the market right now. The binding interactions between MARV VP40, a protein essential to viral replication, and a commercial medication, estradiol benzoate, and a natural substance, procyanidin, were examined in this work. Ten hydrogen bonds and hydrophobic interactions with important residues (Ala316, Val317, Lys230, Glu89, Asn87) stabilized procyanidin's superior binding affinity (- 11.3 kcal/mol) over estradiol benzoate (- 8.9 kcal/mol), according to molecular docking. With a lower radius of gyration (1.94 nm) and RMSD (0.28 nm) than estradiol benzoate (RMSD: 0.37 nm, Rg: 1.97 nm), procyanidin formed a more stable complex, according to molecular dynamics simulations conducted over 200 ns. Additionally, procyanidin showed decreased solvent accessibility and increased intermolecular hydrogen bonding (average 3.50 bonds), suggesting stronger binding. Procyanidin's superior drug-likeness, decreased cardiotoxicity, and decreased carcinogenicity potential were all shown by ADMET analysis. Its higher binding energy (- 57.82 KJ/mol) was further validated by free energy calculations (MM-PBSA). According to these results, procyanidin, a natural substance shows promise as an antiviral medication against MARV targeting its VP40 protein.",2025 Jul 25,"['west africa', 'resurgence', 'marburg virus disease', 'mvd', 'zoonotic', 'pathogen', 'severe', 'hemorrhagic fever', 'humans', 'primates', 'effective', 'medications', 'market', 'binding interactions', 'marv', 'vp40', 'protein', 'essential', 'viral replication', 'commercial medication', 'estradiol benzoate', 'natural substance', 'procyanidin', 'hydrogen bonds', 'hydrophobic', 'interactions', 'residues', 'ala316', 'val317', 'lys230', 'glu89', 'asn87', 'stabilized', ""procyanidin's"", 'superior', 'estradiol benzoate', 'molecular docking', 'lower radius of gyration', 'rmsd', 'estradiol benzoate', 'rmsd', 'procyanidin', 'complex', 'molecular dynamics simulations', 'procyanidin', 'decreased', 'solvent', 'accessibility', 'increased', 'intermolecular hydrogen bonding', 'bonds', 'stronger', 'binding', ""procyanidin's"", 'superior', 'drug-likeness', 'decreased', 'cardiotoxicity', 'decreased', 'carcinogenicity', 'potential', 'admet analysis', 'binding energy', 'free energy calculations', 'mm-pbsa', 'results', 'procyanidin', 'natural substance', 'antiviral medication', 'marv', 'targeting', 'vp40 protein']",[]
40715493,Evaluation of APACHE II score as predictor of outcome in patients with ruptured liver abscess: prospective study in a tertiary care hospital.,"Ruptured liver abscess is a critical condition with high morbidity and mortality, especially in patients with systemic comorbidities. This 18-month observational cohort study at Safdarjung Hospital, New Delhi, evaluated the prognostic value of the Acute Physiology and Chronic Health Evaluation II (APACHE II) score in predicting outcomes for patients with radiologically confirmed ruptured liver abscesses. A total of 69 patients (88.4% male, mean age 44 years) were included. The most common presenting symptoms were abdominal pain (100%) and fever (76.8%). Treatment modalities included percutaneous catheter drainage (PCD) in 46.4% of patients, open surgical drainage in 34.8%, and conservative management in the remainder. Patients undergoing surgical drainage had significantly higher APACHE II scores (mean 9 +/- 4) than those treated with PCD (mean 7 +/- 3; p = 0.041). The overall mortality rate was 21%, with mortality significantly higher in the surgical group (45.8%) compared to the PCD group (3.1%; p = 0.000). An APACHE II score > 9 was strongly associated with increased mortality and the need for surgery (p = 0.010). Colonic involvement was seen in 41.6% of surgical cases, with 10 cases presenting with colonic perforation. Higher APACHE II scores correlated with longer hospital stays and more severe complications. The study concludes that the APACHE II score is an effective prognostic tool for assessing disease severity and guiding treatment in ruptured liver abscess cases. PCD is favoured for stable patients, while surgical intervention is necessary for those with high APACHE II scores, failed drainage, or colonic involvement, emphasizing the importance of early risk stratification. This study has its limitations of being single centric with a sample size of 69 patients.",2025 Jul 26,"['ruptured', 'liver abscess', 'morbidity', 'mortality', 'patients', 'systemic', 'comorbidities', 'observational', 'cohort study', 'safdarjung hospital', 'new delhi', 'evaluated', 'prognostic value', 'acute physiology and', 'chronic health evaluation ii (', 'score', 'predicting', 'outcomes', 'patients', 'radiologically', 'ruptured', 'liver abscesses', 'patients', 'male', 'age', 'years', 'presenting symptoms', 'abdominal pain', 'fever', 'treatment modalities', 'percutaneous catheter drainage', 'pcd', 'patients', 'open surgical drainage', 'conservative management', 'patients', 'surgical drainage', 'apache ii scores', 'treated with', 'pcd', 'mortality rate', 'mortality', 'significantly higher', 'surgical group', 'pcd', 'group', 'apache ii score', 'associated with', 'increased', 'mortality', 'surgery', 'colonic', 'involvement', 'surgical cases', 'cases', 'colonic perforation', 'apache ii scores', 'correlated', 'longer', 'hospital stays', 'severe', 'complications', 'study', 'apache ii score', 'effective', 'prognostic tool', 'disease severity', 'treatment', 'ruptured', 'liver abscess', 'cases', 'pcd', 'stable', 'patients', 'surgical intervention', 'apache ii scores', 'failed', 'drainage', 'colonic', 'involvement', 'early', 'risk', 'stratification', 'study', 'limitations', 'sample size', 'patients']",[]
40715163,Clinical and molecular epidemiology of chikungunya outbreaks during 2019-2022 in India.,"Chikungunya fever (CHIKF) is endemic in India, with multiple outbreaks occurring across the country since its reemergence in 2005. Suspected CHIKF patients were recruited from four clinical sites during 2019-2022, with data collected on sociodemographic, clinical, and epidemiological aspects. Sera samples were screened for IgM, IgG antibodies and viral RNA along with their neutralizing capacity. Envelope genes of Chikungunya virus (CHIKV) isolated were sequenced and further analysed. A total of 1312 suspected patients were screened during the study period; 258 patients were laboratory-confirmed with CHIKV infection. Severe clinical manifestation was observed in the patients during the viremic phase of infection. The neutralization potential was found to be increasing proportionally with the onset of illness, coinciding with the rise of IgG antibodies. Three of the four clinical sites had reported CHIKF outbreaks at different time points during the study period, and a distinct pattern of clinical presentation was observed across the sites. Phylogenetic and network analyses of E1, E2 and E3 genes from 62 CHIKV isolates demonstrated their evolution within the country. This study provides preliminary evidence of spatial and temporal variation in the clinical presentation and molecular evolution of virus in CHIKF outbreaks across India.",2025 Jul 26,"['chikungunya fever', 'chikf', 'endemic', 'india', 'outbreaks', 'country', 'reemergence', 'suspected', 'chikf', 'patients', 'clinical sites', 'data', 'sociodemographic', 'clinical', 'epidemiological aspects', 'sera', 'screened', 'igm', 'igg antibodies', 'viral rna', 'neutralizing capacity', 'envelope genes', 'chikungunya virus', 'chikv', 'isolated', 'sequenced', 'analysed', 'suspected', 'patients', 'screened', 'study', 'period', 'patients', 'laboratory-confirmed', 'chikv', 'infection', 'clinical', 'manifestation', 'patients', 'viremic', 'neutralization', 'potential', 'increasing', 'onset of', 'illness', 'igg antibodies', 'clinical sites', 'chikf', 'outbreaks', 'time points', 'study', 'period', 'pattern', 'clinical presentation', 'sites', 'phylogenetic', 'network analyses', 'e3 genes', 'chikv', 'isolates', 'evolution', 'country', 'study', 'evidence', 'spatial', 'temporal', 'variation', 'clinical presentation', 'molecular evolution', 'virus', 'chikf', 'outbreaks', 'india']",['India']
