PMID,Title,Abstract,Date,Entities,Countries
40682584,Stent Infection Leading to Coronary Aneurysm and Coronary Cameral Fistula.,"BACKGROUND: Coronary stent infection (SI) is a rare but catastrophic complication, occurring in 0.3% to 6% of cases post-percutaneous coronary intervention (PCI). Early diagnosis and surgical interventions are crucial for definitive diagnosis and management. CASE SUMMARY: A 52-year-old man underwent PCI for an inferior wall myocardial infarction to the left circumflex artery (LCx) with a single sirolimus-eluting stent. He developed a fever 10 days later due to methicillin-sensitive Staphylococcus aureus. Imaging showed a coronary cameral fistula with a left atrial appendage (LAA) mycotic aneurysm. He was treated with antibiotics, stent explantation, abscess drainage, and fistula repair; however, he developed refractory vasoplegia and died 2 days post-surgery. DISCUSSION: Coronary SI requires a high index of suspicion. The use of multimodality imaging and multidisciplinary approaches to diagnose and manage infection is essential. Late and complicated stent infections have a high mortality rate. TAKE-HOME MESSAGE: Coronary SI is an important differential diagnosis for fever post-PCI. Prompt diagnosis, multimodality imaging, and early intervention are needed.",2025 Jun 20,"['background', 'coronary stent infection', 'rare', 'catastrophic', 'complication', 'cases', 'post-percutaneous coronary intervention', 'pci', 'early diagnosis', 'surgical interventions', 'definitive', 'diagnosis', 'management', 'man', 'pci', 'inferior wall myocardial infarction', 'left circumflex artery', 'lcx', 'sirolimus-eluting', 'stent', 'fever', 'days', 'methicillin-sensitive', 'staphylococcus aureus', 'imaging', 'coronary cameral fistula', 'left atrial appendage', 'laa', 'mycotic aneurysm', 'treated with', 'antibiotics', 'stent explantation', 'abscess drainage', 'fistula repair', 'refractory', 'vasoplegia', 'died', 'days', 'post-surgery', 'coronary si', 'suspicion', 'multimodality imaging', 'multidisciplinary approaches', 'diagnose', 'manage', 'infection', 'essential', 'late', 'complicated', 'stent infections', 'mortality rate', 'coronary si', 'differential diagnosis', 'fever', 'post-pci', 'prompt diagnosis', 'multimodality imaging', 'early intervention']",[]
40678943,'White islands in a sea of red' in dengue fever: Recognising a distinct rash pattern.,,2025 Jul 18,[],[]
40675253,"Outbreak of leptospirosis caused by Leptospira wolffii with HAV coinfections in lower Assam, Northeast India in 2024: Clinical impact and public health implications.","BACKGROUND: In February-March 2024, an outbreak of unknown fever and jaundice with multiple fatalities was reported in Goalpara District, Assam, India. This study aimed to identify the etiological agents responsible for the outbreak to guide public health interventions. METHODS: Clinical samples from 30 individuals were collected and analyzed using serological and molecular techniques. Serological testing for Hepatitis A Virus (HAV), Hepatitis E Virus (HEV), and Leptospira was performed using IgM ELISA kits. Leptospira DNA was extracted and amplified using PCR targeting the 16S rRNA gene, followed by next-generation sequencing (NGS) for further analysis. RESULTS: The results revealed HAV IgM antibodies in 23.33 % of cases (7/30), while 40 % (12/30) tested positive for Leptospira-specific IgM by ELISA. Additionally, PCR targeting the 16S rRNA gene confirmed Leptospira DNA in 53.33 % of the urine samples (8/15). Notably, 16.67 % (5/30) of cases exhibited coinfection with both HAV and Leptospira spp., challenging the clinical outcome. Sequencing and phylogenetic analysis of PCR-positive samples identified Leptospira wolffii (L. wolffii) as the causative agent, marking the first report of L. wolffii in human clinical samples from Northeastern India. Recently, L. wolffii, a member of the P2 subclade of Leptospira, has garnered attention due to its pathogenic potential. CONCLUSION: The findings along with reported fatalities, emphasize the pathogenic potential of L. wolffii and its likely introduction into the region, via cross-border transmission from neighboring Bangladesh, where the strain is prevalent. This study highlights the need for enhanced surveillance and research to monitor emerging Leptospira strains, particularly L. wolffii, in both human and animal populations, to better understand its epidemiology, pathogenicity, and public health implications.",2025 Jul 15,"['background', 'february-march', 'outbreak', 'unknown', 'fever', 'jaundice', 'multiple', 'fatalities', 'goalpara district', 'assam', 'india', 'study', 'etiological agents', 'outbreak', 'public', 'clinical samples', 'individuals', 'collected', 'analyzed', 'serological', 'molecular techniques', 'serological testing', 'hepatitis a virus', 'hav', 'hepatitis e virus', 'hev', 'leptospira', 'igm elisa kits', 'leptospira dna', 'amplified', 'pcr', 'targeting', '16s rrna gene', 'next-generation sequencing', 'ngs', 'analysis', 'results', 'hav', 'cases', 'positive', 'leptospira-specific igm', 'elisa', 'pcr', 'targeting', '16s rrna', 'leptospira dna', 'urine samples', 'cases', 'coinfection', 'hav', 'leptospira spp', 'clinical outcome', 'sequencing', 'phylogenetic analysis', 'pcr-positive', 'samples', 'leptospira wolffii', 'l. wolffii', 'causative agent', 'l. wolffii', 'human', 'clinical samples', 'northeastern india', 'l. wolffii', 'p2 subclade', 'leptospira', 'pathogenic', 'potential', 'findings', 'fatalities', 'pathogenic', 'potential', 'l. wolffii', 'introduction', 'region', 'cross-border transmission', 'neighboring', 'bangladesh', 'strain', 'study', 'enhanced', 'surveillance', 'research', 'leptospira strains', 'l. wolffii', 'human', 'animal populations', 'epidemiology', 'pathogenicity', 'public health']","['Bangladesh', 'India']"
40673322,A Comprehensive Guide to Typhoidal Anemia.,"Typhoid fever, caused primarily by Salmonella Typhi and Paratyphi, stands as a significant global health concern, with complications extending beyond the typical gastrointestinal manifestations. This review systematically examines the intricate relationship between typhoid fever and hematologic complications, collectively referred to as typhoidal anemia. Hematological abnormalities, including changes in blood profiles and bone marrow responses, are scrutinized, providing a comprehensive understanding of the disease's impact on physiological systems. Specific populations, such as immunocompromised individuals, sickle cell anemia patients, and children in resource-limited settings, reveal varied susceptibilities and outcomes. Complications, such as psoas abscess and secondary hemophagocytic lymphohistiocytosis, are explored, highlighting the multifaceted nature of the disease. The distinct contributions of Salmonella Typhi and Paratyphi to anemia are elucidated, shedding light on the pathophysiological mechanisms involved. Global prevalence and epidemiological variations offer valuable perspectives, underscoring the importance of regional nuances in disease manifestation. Challenges in accurate diagnosis and treatment limitations are acknowledged, emphasizing the need for continued research to enhance diagnostic precision and therapeutic strategies. Insights into long-term effects, prognosis, and the influence of host factors contribute to a holistic understanding of typhoidal anemia. The review concludes by identifying critical gaps in knowledge, advocating for ongoing research initiatives and heightened awareness campaigns. The synthesis of diverse findings provides a comprehensive overview of typhoidal anemia, underscoring the imperative of continued research and awareness for improved patient care and global public health.",2025,"['typhoid fever', 'salmonella typhi', 'paratyphi', 'global health concern', 'complications', 'gastrointestinal', 'review', 'systematically', 'intricate', 'relationship', 'typhoid fever', 'hematologic complications', 'typhoidal anemia', 'hematological abnormalities', 'changes', 'blood profiles', 'bone marrow responses', 'scrutinized', 'comprehensive', ""disease's"", 'impact', 'physiological systems', 'populations', 'immunocompromised', 'individuals', 'sickle cell anemia', 'patients', 'children', 'resource-limited settings', 'susceptibilities', 'outcomes', 'complications', 'psoas abscess', 'secondary hemophagocytic lymphohistiocytosis', 'disease', 'contributions', 'salmonella typhi', 'paratyphi', 'anemia', 'shedding light', 'pathophysiological', 'mechanisms', 'global prevalence', 'epidemiological variations', 'regional', 'disease manifestation', 'accurate', 'diagnosis', 'treatment', 'research', 'diagnostic precision', 'therapeutic strategies', 'long-term', 'effects', 'prognosis', 'influence', 'host', 'holistic', 'typhoidal anemia', 'review', 'gaps', 'knowledge', 'research', 'heightened', 'awareness', 'campaigns', 'synthesis', 'diverse', 'findings', 'comprehensive', 'overview', 'typhoidal anemia', 'research', 'awareness', 'improved', 'patient care', 'global public health']",['Mali']
40667450,Empagliflozin-related DRESS syndrome.,"A 61-year-old male with coronary artery disease, multiple percutaneous transluminal coronary angioplasty with stenting (PTCA + S recent 4 months back) and heart failure with reduced ejection fraction (with left ventricular ejection fraction of 39%) presented with complaints of itching and redness all over the body for 3-4 days and fever for 1 day. He was started on tablet Empagliflozin 10 mg/d a fortnight ago, which was the only change in his medications. His laboratory workup revealed an elevated total leukocyte count (11 200/mm(3)) with eosinophilia (19%) and an absolute eosinophil count of 2100/mm(3), along-with raised C-reactive protein levels (87.98 mg/dL) and serum IgE (585.83 kU/L). His serum creatinine was raised (1.39 mg/dL), along with raised aspartate aminotransferase of 108 IU/L and alanine aminotransferase of 102 IU/L levels. He was diagnosed with drug reaction with eosinophilia and systemic symptoms (DRESS) syndrome as per RegiSCAR DRESS validation score of seven and tablet empagliflozin was stopped. Drug reaction with eosinophilia and systemic symptoms syndrome is a distinct, severe, idiosyncratic reaction to a drug characterized by a prolonged latency period. It is followed by a variety of clinical manifestations, usually fever, rash, lymphadenopathy, eosinophilia, and a wide range of mild-to-severe systemic presentations. His condition improved with injectable steroid and supportive treatment over next 3 weeks.",2025 Jul,"['male', 'coronary artery disease', 'multiple percutaneous transluminal coronary angioplasty', 'stenting', 'ptca', 'months', 'heart failure', 'reduced ejection fraction', 'left ventricular ejection fraction', 'complaints', 'itching', 'redness', 'body', 'days', 'fever', 'day', 'tablet', 'empagliflozin', 'medications', 'laboratory workup', 'elevated', 'eosinophilia', 'absolute', 'eosinophil', 'along-with', 'serum ige', 'serum creatinine', 'aspartate aminotransferase', 'alanine aminotransferase', 'levels', 'diagnosed', 'drug reaction', 'eosinophilia', 'systemic symptoms', 'dress', 'regiscar', 'dress', 'validation', 'tablet', 'empagliflozin', 'drug reaction', 'eosinophilia', 'systemic symptoms syndrome', 'severe', 'idiosyncratic reaction', 'drug', 'characterized', 'prolonged', 'latency', 'period', 'clinical manifestations', 'fever', 'rash', 'lymphadenopathy', 'eosinophilia', 'mild-to-severe', 'presentations', 'improved', 'injectable', 'steroid', 'supportive treatment', 'weeks']",[]
40665219,The global burden of typhoid and paratyphoid fever from 1990 to 2021 and the impact on prevention and control.,"BACKGROUND: Typhoid and paratyphoid fever are common infectious diseases and remain a heavy burden, especially in some low-income countries. Although the global burden has decreased over the past three decades, an analysis of the burden of typhoid and paratyphoid fever will help inform public health strategies. METHODS: This study is aimed to comprehensively evaluate the global, regional, and national burden of typhoid and paratyphoid, and the temporal trends while exploring potential associations with socio-demographic development over three decades (1990-2021). Data on typhoid and paratyphoid fever were analyzed using the Global Burden of Disease (GBD) study in 2021. For this analysis, we calculated to demonstrate temporal trends in the incidence, mortality, and disability adjusted life years (DALYs) of typhoid and paratyphoid fever from 1990 to 2021. RESULTS: From 1990 to 2021, both typhoid and paratyphoid fever showed declining trends globally and in different socio-demographic index (SDI) regions, including incidence, mortality, and DALYs. For typhoid fever worldwide, new cases decreased by 62.12%, with an EAPC of -3.92 (-4.14, -3.71); deaths decreased by 50.65%, EAPC - 2.83 (-2.99, -2.66), and DALYs decreased by 52.30%, EAPC - 2.82 (-3.00, -2.64). For paratyphoid fever, new cases decreased by 73.15%, with an EAPC of -4.77 (-5.29, -4.26); deaths decreased by 65.44%, EAPC - 3.74 (-4.24, -3.24), and DALYs decreased by 68.42%, EAPC - 3.87 (-4.42, -3.31). For both typhoid and paratyphoid fever, children had the highest morbidity and mortality rates; males had higher rates of incidence, mortality, and DALYs than females. However, among older patients, the absolute number of new cases and DALYs was higher in women. The burden is concentrated in South Asia, Southeast Asia, and Oceania, with only South Asia suffering severely from paratyphoid fever. Regarding typhoid fever, the top three countries with the highest ASRs of incidence are Burkina Faso (328.48) (SDI: 0.285), Bangladesh (303.14) (SDI: 0.492), and Papua New Guinea (299.45) (SDI: 418) which are in Western Sub-Saharan, South Asia, and Oceania. The top three countries in terms of mortality and DALYs are Bhutan (5.61; 434.23) (SDI: 0.473), Bangladesh (5.06; 382.38), and Burkina Faso (4.64; 352.57). Regarding paratyphoid fever, the top three countries with the highest ASRs of mortality and DALYs are the same, including Pakistan (1.05; 72.66), India (0.75; 53.42), and Nepal (0.72; 50.65) (SDI: 0.433), all of which are located in South Asia.",2025 Jul 15,"['background', 'typhoid', 'paratyphoid fever', 'infectious diseases', 'heavy burden', 'low-income countries', 'global burden', 'decreased', 'decades', 'analysis', 'burden', 'typhoid', 'paratyphoid fever', 'public health', 'study', 'evaluate', 'global', 'regional', 'national burden', 'typhoid', 'paratyphoid', 'temporal', 'trends', 'associations', 'socio-demographic development', 'decades', 'data', 'typhoid', 'paratyphoid fever', 'analyzed', 'global burden of disease', 'study', 'analysis', 'temporal', 'trends', 'incidence', 'mortality', 'disability', 'life years', 'dalys', 'typhoid', 'paratyphoid fever', 'typhoid', 'paratyphoid fever', 'declining', 'trends', 'socio-demographic index', 'incidence', 'mortality', 'dalys', 'typhoid fever', 'cases', 'decreased', 'eapc', 'deaths', 'decreased', 'eapc', 'dalys', 'decreased', 'eapc', 'paratyphoid fever', 'cases', 'decreased', 'eapc', 'deaths', 'decreased', 'eapc', 'dalys', 'decreased', 'eapc', 'typhoid', 'paratyphoid fever', 'children', 'highest', 'morbidity', 'mortality rates', 'males', 'rates', 'incidence', 'mortality', 'dalys', 'females', 'older patients', 'absolute', 'cases', 'dalys', 'women', 'burden', 'south asia', 'southeast asia', 'oceania', 'south asia', 'suffering', 'severely', 'paratyphoid fever', 'typhoid fever', 'countries', 'asrs', 'incidence', 'burkina faso', 'sdi', 'bangladesh', 'sdi', 'papua new guinea', 'sdi', 'western sub-saharan', 'south asia', 'oceania', 'countries', 'mortality', 'dalys', 'bhutan', 'sdi', 'bangladesh', 'burkina faso', 'paratyphoid fever', 'countries', 'asrs', 'mortality', 'dalys', 'pakistan', 'india', 'nepal', 'sdi', 'south asia']","['Burkina Faso', 'Bangladesh', 'Bhutan', 'Guinea', 'India', 'Nepal', 'Pakistan', 'Papua New Guinea']"
40662738,Role of cycle threshold values in predicting poor outcomes in patients with Kyasanur Forest disease: a retrospective cohort study.,"BACKGROUND: Kyasanur Forest Disease (KFD) is a tick-borne viral haemorrhagic illness endemic to southern India. Early identification of patients at risk for poor outcomes remains a clinical challenge. The study aimed to evaluate the role of cycle threshold (Ct) values in predicting outcomes. METHODS: We conducted a retrospective cohort study of adults with PCR-confirmed KFD admitted to a tertiary care hospital in South India between January 2019 and December 2024. The primary outcome was 28-day all-cause mortality. Univariate and multivariable logistic regression analyses were performed to identify independent predictors of mortality. Receiver operating characteristic (ROC) analysis was used to assess the prognostic performance of Ct values. RESULTS: Among 213 patients, 20 (9.4%) died. Mortality was independently associated with lower Ct values, older age, lower respiratory tract involvement, altered sensorium, and elevated white blood cell counts on multivariable analysis. ROC analysis yielded an area under the curve of 0.675 for Ct value alone. A Ct cut-off >/=27.75 predicted survival with 68.4% sensitivity and 70.0% specificity. CONCLUSION: Lower Ct values are independently associated with increased mortality in KFD and may serve as a pragmatic tool for early risk stratification, especially in resource-limited settings.",2025 Dec,"['background', 'kyasanur forest disease', 'kfd', 'tick-borne', 'viral haemorrhagic illness', 'endemic', 'southern india', 'early identification', 'patients', 'risk', 'poor outcomes', 'clinical challenge', 'study', 'evaluate', 'cycle threshold', 'predicting', 'outcomes', 'retrospective cohort study', 'adults', 'pcr-confirmed', 'kfd', 'admitted', 'tertiary care hospital', 'south india', 'primary outcome', 'mortality', 'univariate', 'multivariable logistic regression analyses', 'independent', 'predictors', 'mortality', 'receiver operating characteristic (roc) analysis', 'prognostic', 'ct values', 'patients', 'died', 'mortality', 'associated with', 'ct values', 'older age', 'lower respiratory tract', 'involvement', 'sensorium', 'elevated', 'multivariable analysis', 'roc analysis', 'area', 'ct value', 'predicted', 'survival', 'sensitivity', 'specificity', 'ct values', 'associated with', 'increased', 'mortality', 'kfd', 'pragmatic tool', 'early', 'risk', 'stratification', 'resource-limited settings']",['India']
40659376,NXP-2-positive polymyositis associated with scrub typhus.,"Polymyositis (PM), a rare autoimmune inflammatory myopathy, typically presents with symmetric proximal muscle weakness and elevated muscle enzymes. A muscle biopsy is confirmatory for the diagnosis. We report a case of a woman in her 30s with scrub typhus and anti-nuclear matrix protein 2 (NXP2) positive PM. The patient presented with fever, proximal muscle weakness, dysphagia and serologically confirmed scrub typhus a month prior. Laboratory investigations revealed a positive ELISA IgM for scrub typhus, elevated creatine kinase and elevated transaminases, leading to a provisional diagnosis of scrub myositis. However, further investigations, including electromyography, nerve conduction studies, muscle biopsy and the detection of myositis-specific anti-NXP-2 antibodies suggested PM. The patient was successfully treated with corticosteroids, cyclophosphamide and azathioprine, resulting in significant improvement of symptoms. This case highlights the importance of considering idiopathic inflammatory myopathy in patients with persistent muscle weakness and pain and underscores the need for a comprehensive diagnostic approach to ensure prompt and effective treatment.",2025 Jul 13,"['polymyositis', 'rare', 'autoimmune inflammatory myopathy', 'elevated', 'muscle biopsy', 'confirmatory', 'diagnosis', 'case', 'woman', 'scrub typhus', 'anti-nuclear matrix protein 2', 'nxp2', 'positive', 'patient', 'fever', 'proximal muscle weakness', 'dysphagia', 'serologically', 'scrub', 'month', 'laboratory investigations', 'positive', 'elisa', 'igm', 'scrub typhus', 'elevated', 'creatine kinase', 'elevated', 'transaminases', 'provisional diagnosis', 'scrub myositis', 'investigations', 'electromyography', 'nerve conduction studies', 'muscle biopsy', 'detection', 'myositis-specific anti-nxp-2 antibodies', 'patient', 'treated with', 'corticosteroids', 'cyclophosphamide', 'azathioprine', 'improvement', 'symptoms', 'idiopathic inflammatory myopathy', 'patients', 'persistent', 'muscle weakness', 'pain', 'comprehensive', 'diagnostic approach', 'prompt', 'effective', 'treatment']",['Oman']
40658430,An Unusual Cause of Atrioventricular Block.,,2025 Jul 14,[],[]
40657629,Obliteration of oral and maxillofacial region by SARS-CoV-2 infection.,"COVID-19 present as fever, cough, dyspnea, and pneumonia. The infection causes orofacial manifestations in several cases but seems to be underreported, mainly due to the lack of oral examination of patients with suspected and/or confirmed COVID-19. Described are COVID-19- related oral lesions that can be the first and/or the unique manifestation of the disease.",2025,"['covid-19', 'fever', 'cough', 'dyspnea', 'pneumonia', 'infection', 'orofacial manifestations', 'cases', 'underreported', 'lack', 'oral examination', 'patients', 'suspected', 'covid-19', 'covid-19-', 'oral', 'unique', 'manifestation', 'disease']",[]
40655765,Cat Scratch Disease - The Inconspicuous Cause of Cervical Lymphadenopathy.,"Bacterial cat scratch disease (CSD), also called cat scratch fever or subacute regional lymphadenitis, affects lymph nodes draining from the implantation site. Bartonella henselae causes most CSD and could be regarded as a cause of concern for acute lymphadenopathy in individuals of all ages. CSD frequently resembles cervical lymphadenopathy or submandibular gland disorders, making diagnosis difficult. This study describes a 12-year-old girl who contracted cat scratch disease with swelling of submandibular lymph nodes following intimate contact with a pet cat.",2025 Jun,"['bacterial', 'cat scratch disease', 'csd', 'cat scratch fever', 'subacute', 'lymph nodes', 'implantation', 'bartonella henselae', 'csd', 'acute lymphadenopathy', 'individuals', 'ages', 'csd', 'cervical lymphadenopathy', 'submandibular gland disorders', 'diagnosis', 'difficult', 'study', 'girl', 'cat scratch disease', 'swelling', 'submandibular lymph nodes', 'intimate contact with', 'pet', 'cat']",[]
40655683,Hepatocellular Carcinoma in South Indian Population: Clinical Profile and AFP Correlation with Radiological Tumor Size.,"OBJECTIVES: To study the clinical profile of hepatocellular carcinoma (HCC) in a tertiary care hospital and alpha fetoprotein correlation (AFP) with radiological tumor size. MATERIALS AND METHODS: A prospective observational study was conducted from February 2023 to August 2024. There were 57 cases of HCC enrolled. Patient details were noted, such as demographics, clinical characteristics, tumor characteristics, disease severity and their treatment. The data was compiled and analyzed. The outcome measures were association of tumor size with AFP levels. RESULTS: Patients had a mean age of 63.1 years and a BMI of 27.02 kg/m(2). Common risk factors were diabetes mellitus and alcohol in 47.4% and 43.9%, respectively. The common symptoms were abdominal pain (right hypochondrium) in 40 (70.2%) patients, abdominal distension in 36 (63.2%), jaundice in 19 (33.3%), weight loss in 10 (17.5%), fever in 8 (14.0%). Hepatomegaly was present in 29 (50.9%) patients, ascites in 27 (47.4%), splenomegaly in 10 (17.5%), liver bruit and pleural effusion in 6 (10.5%) patients each, and hepatic encephalopathy in 4 (7.0%) patients. CONCLUSION: HCC patients were primarily older men with diabetes and alcohol being common risk factors. Abdominal pain and distention remain common findings with complications of cirrhosis, esophageal varices, and pleural effusion. AFP levels and imaging modalities were the most important aids for the diagnosis, management and prognosis. Majority of the treatment remains supportive in the form of transarterial chemoembolization (TACE), transarterial radioembolization (TARE), stereotactic body radiation therapy (SBRT) etc. with few cases demanding interventional therapies.",2025 Jun,"['objectives', 'study', 'clinical profile', 'hepatocellular carcinoma', 'hcc', 'tertiary care hospital', 'alpha fetoprotein correlation', 'afp', 'radiological', 'tumor size', 'prospective observational study', 'cases', 'hcc', 'patient details', 'demographics', 'clinical characteristics', 'tumor characteristics', 'disease severity', 'treatment', 'data', 'analyzed', 'outcome measures', 'association', 'tumor size', 'afp', 'levels', 'patients', 'age', 'years', 'bmi', 'risk factors', 'diabetes mellitus', 'alcohol', 'symptoms', 'abdominal pain', 'right hypochondrium', 'patients', 'abdominal distension', 'jaundice', 'weight loss', 'fever', 'hepatomegaly', 'patients', 'ascites', 'splenomegaly', 'liver bruit', 'pleural effusion', 'patients', 'hepatic encephalopathy', 'patients', 'hcc', 'patients', 'older', 'men', 'diabetes', 'alcohol', 'risk factors', 'abdominal pain', 'distention', 'findings', 'complications', 'cirrhosis', 'esophageal varices', 'pleural effusion', 'afp', 'levels', 'imaging modalities', 'diagnosis', 'management', 'prognosis', 'treatment', 'transarterial chemoembolization', 'tace', 'transarterial radioembolization', 'tare', 'stereotactic body radiation therapy', 'sbrt', 'cases', 'interventional therapies']",[]
