PMID,Title,Abstract,Date,Entities,Countries
40627640,Determining genotype and antimicrobial resistance of Salmonella Typhi in environmental samples by amplicon sequencing.,"BACKGROUND: Estimates of the burden of typhoid fever due to Salmonella enterica serovar Typhi (S. Typhi) rely on data from clinical surveillance, which is rarely done in low income settings and is also limited by the poor sensitivity of the assays used and the reliance on health seeking by patients. Environmental surveillance for S. Typhi shed by symptomatic and asymptomatic individuals in wastewater offers a sensitive surveillance tool that could help to inform burden estimates. Sequencing S. Typhi direct from wastewater concentrates has the potential to identify circulating genotypes and associated antimicrobial resistance (AMR) genes, supporting public health interventions such as vaccination and antimicrobial usage. METHODOLOGY AND PRINCIPAL FINDINGS: We designed a multiplex targeted amplicon sequencing protocol for genotyping and determining AMR in S. Typhi from wastewater samples, targeting SNPs that identify genotypes of interest and both chromosomal and plasmid-borne AMR. PCR products were sequenced using the Oxford Nanopore Technologies (ONT) MinION, and genotypes and AMR identified using the GenoTyphi program. We tested this approach on samples from south India from both hospital outflow and wastewater collected from the community. All samples tested were suspected to be positive for S. Typhi following quantitative PCR for ttr, tviB, and staG gene targets. Out of 110 samples tested we were able to determine a genotype and/or AMR for 8. All samples that gave a genotype call suggested a genotype consistent with those found in clinical cases in India during the same time period and produced consensus sequences that clustered with S. Typhi when included in a phylogenetic tree. CONCLUSIONS: In this study, we provide proof of concept data for amplicon sequencing of S. Typhi in wastewater which with further optimisation could be used to complement clinical surveillance data or provide data on S. Typhi presence in the absence of clinical surveillance. This information can inform public health interventions, and the concept could be applied to other pathogens of interest for genotyping from environmental surveillance samples.",2025 Jul,"['background', 'estimates', 'burden', 'typhoid fever', 'salmonella enterica serovar typhi', 's. typhi', 'data', 'clinical surveillance', 'low income settings', 'poor sensitivity', 'assays', 'health seeking', 'patients', 'environmental', 'surveillance', 's. typhi', 'symptomatic', 'asymptomatic', 'individuals', 'wastewater', 'sensitive', 'surveillance tool', 'burden', 'estimates', 'sequencing', 's. typhi', 'wastewater', 'potential', 'circulating', 'genotypes', 'antimicrobial resistance', 'amr', 'public health', 'vaccination', 'antimicrobial', 'usage', 'principal findings', 'multiplex', 'genotyping', 'amr', 's. typhi', 'wastewater samples', 'targeting', 'snps', 'genotypes', 'chromosomal', 'plasmid-borne', 'amr', 'pcr products', 'sequenced', 'oxford nanopore technologies', 'ont', 'genotypes', 'amr', 'identified', 'genotyphi program', 'samples', 'south india', 'hospital outflow', 'wastewater', 'collected', 'community', 'samples', 'tested', 'suspected', 'positive', 's. typhi', 'quantitative pcr', 'ttr', 'tvib', 'stag', 'gene targets', 'samples', 'genotype', 'amr', 'samples', 'genotype', 'genotype', 'consistent with', 'clinical cases', 'india', 'time', 'consensus sequences', 'clustered', 's. typhi', 'phylogenetic tree', 'study', 'concept', 'data', 'amplicon sequencing', 's. typhi', 'wastewater', 'optimisation', 'clinical', 'data', 'data', 's. typhi', 'presence', 'absence', 'clinical surveillance', 'information', 'public health', 'interventions', 'concept', 'pathogens', 'genotyping', 'environmental surveillance samples']",['India']
40625744,GMMA-based vaccine candidates against invasive nontyphoidal salmonellosis elicit bactericidal antibodies against a panel of epidemiologically relevant Salmonellae.,"Systemic disease caused by nontyphoidal Salmonella (NTS) represents a major cause of death and morbidity, especially in young children in sub-Saharan Africa. No licensed vaccine is yet available, and an increase in antimicrobial resistance makes the development of a vaccine a global health priority. We are developing a bivalent formulation of Salmonella Typhimurium and Salmonella Enteritidis generalized modules for membrane antigens (GMMA)-based vaccine (iNTS-GMMA) and a trivalent formulation (iNTS-TCV) in which iNTS-GMMA is combined with the WHO-prequalified TYPHIBEV (Biological E, India) vaccine to prevent typhoid fever in addition to invasive NTS (iNTS) disease. Here, we measured the ability of antibodies induced by iNTS-GMMA and iNTS-TCV formulations in mice and rabbits to kill a broad panel of Salmonella in vitro in a complement-mediated fashion. These organisms include those causing invasive disease in Africa and Southeast Asia, global representatives causing gastroenteritis and other S. enterica serovars in addition to S. Typhimurium and S. Enteritidis. We characterized the O-antigen of the panel of isolates and demonstrated the sera functionality in both animal species against all isolates, providing evidence of the potential broad coverage of both GMMA-based formulations, which are currently undergoing testing in Phase I/II clinical trials.",2025,"['systemic disease', 'nontyphoidal', 'salmonella', 'nts', 'death', 'morbidity', 'young', 'children', 'sub-saharan africa', 'licensed', 'vaccine', 'increase', 'antimicrobial resistance', 'development', 'vaccine', 'global health priority', 'bivalent formulation', 'salmonella typhimurium', 'salmonella enteritidis', 'membrane antigens', 'vaccine', 'ints-gmma', 'trivalent formulation', 'ints-gmma', 'who-prequalified', 'typhibev', 'biological e', 'india', 'vaccine', 'prevent', 'typhoid fever', 'invasive', 'nts', 'measured', 'ability', 'antibodies', 'induced', 'ints-gmma', 'mice', 'rabbits', 'kill', 'salmonella', 'in vitro', 'complement-mediated fashion', 'organisms', 'invasive disease', 'africa', 'southeast asia', 'global representatives', 'gastroenteritis', 's. enterica', 'serovars', 's. typhimurium', 's. enteritidis', 'o-antigen', 'isolates', 'sera functionality', 'animal species', 'isolates', 'evidence', 'potential', 'coverage', 'gmma-based formulations', 'testing', 'phase i/ii', 'clinical']",['India']
40623777,X-linked lymphoproliferative syndrome type 1 presenting as DRESS-HLH overlap syndrome.,"A preadolescent male, born to 3rd-degree consanguineous parents, presented with persistent fever, cough and dyspnoea. He had non-resolving suppurative otitis media and two episodes of pneumonia in the past 2 years. During admission, clinical and radiological evaluations revealed bilateral lung consolidation with synpneumonic effusion. Examination also revealed the absence of bilateral tonsils. Blood and pleural fluid cultures were sterile. The child developed a drug reaction with eosinophilia and systemic symptoms (DRESS) associated with haemophagocytic-lymphohistiocytic syndrome (HLH) during the hospital stay. Given his history of recurrent infections and absent tonsils, primary immunodeficiency disorder was suspected. Immunological work-up showed reduced levels of IgG and IgM in serum. Exome sequencing identified a mutation in the SH2D1A gene confirming a diagnosis of X-linked lymphoproliferative syndrome (Duncan syndrome). The child was started on regular intravenous immunoglobulin therapy, along with bacterial and fungal prophylaxis. His parents were counselled regarding the prognosis and necessity of haematopoietic stem cell transplantation as the definitive treatment.",2025 Jul 7,"['preadolescent', 'male', 'born', 'consanguineous', 'parents', 'persistent', 'fever', 'cough', 'dyspnoea', 'non-resolving', 'suppurative', 'otitis media', 'episodes', 'pneumonia', 'years', 'admission', 'clinical', 'radiological', 'evaluations', 'bilateral', 'lung consolidation', 'synpneumonic effusion', 'examination', 'absence', 'bilateral', 'tonsils', 'blood', 'pleural fluid cultures', 'sterile', 'child', 'drug reaction', 'eosinophilia', 'systemic symptoms', 'dress', 'associated with', 'haemophagocytic-lymphohistiocytic syndrome', 'hlh', 'hospital stay', 'history', 'recurrent infections', 'absent', 'tonsils', 'primary immunodeficiency disorder', 'suspected', 'immunological', 'work-up', 'reduced', 'levels', 'igg', 'igm', 'serum', 'exome sequencing', 'mutation', 'sh2d1a gene', 'diagnosis', 'x-linked lymphoproliferative syndrome', 'duncan syndrome', 'child', 'intravenous', 'bacterial', 'fungal prophylaxis', 'parents', 'counselled', 'prognosis', 'haematopoietic stem cell transplantation', 'definitive', 'treatment']",[]
40623500,"Yellow fever in South America in 2025: a concerning increase, but a true resurgence?",,2025 Jul 5,[],[]
40622975,Chikungunya masquerading as dengue infection in Sri Lanka uncovered by metagenomics.,"INTRODUCTION: Dengue is a significant threat to human health in South and Southeast Asia where patients are treated without diagnostic confirmation during outbreaks. This approach, though cost-effective may miss important infections especially those caused by other arboviruses (e.g., Zika, Chikungunya and West Nile virus). This study aimed to diagnose missed infections mimicking dengue by using metagenomic next generation sequencing (mNGS). METHODS AND PRINCIPAL FINDINGS: Total nucleic acid (DNA and RNA) was extracted and subjected to mNGS from acute infection plasma of 60 patients from a prospective cohort study in Sri Lanka in which patients with clinically suspected dengue fever were recruited but were later confirmed as dengue-negative by NS1 antigen testing and by dengue-specific reverse transcription and polymerase chain reaction (RT-PCR) analysis. mNGS data revealed missed chikungunya and dengue infections in five patients each, and a possible bacterial infection by Klebsiella pneumoniae in another patient. It was not possible to differentiate chikungunya infections from dengue infections based on clinical features or routine non-diagnostic laboratory tests conducted in early infection (e.g., full blood count, C-reactive protein level). Phylogenetic analysis showed that the chikungunya sequences from this study were closely related to those sequenced from Maldives, Malaysia, India and Singapore between 2015-2019. CONCLUSIONS: Chikungunya infection may masquerade as dengue especially in low- and middle-income countries where dengue is treated based on clinical suspicion only - without confirmatory testing. As both infections are likely prevalent worldwide, but the complications and natural history of chikungunya and dengue infections are quite different, the addition of cheap and accessible diagnostics for both infections should be pursued in endemic countries.",2025,"['dengue', 'threat', 'human', 'health', 'south', 'southeast asia', 'patients', 'treated', 'diagnostic', 'outbreaks', 'cost-effective', 'infections', 'arboviruses', 'zika', 'chikungunya', 'west nile virus', 'study', 'diagnose', 'infections', 'mimicking', 'dengue', 'metagenomic', 'next generation sequencing', 'mngs', 'principal findings', 'nucleic acid', 'dna', 'rna', 'mngs', 'acute infection', 'plasma', 'patients', 'prospective cohort study', 'sri lanka', 'patients', 'clinically suspected', 'dengue fever', 'dengue-negative', 'ns1 antigen testing', 'dengue-specific', 'polymerase chain reaction', 'rt-pcr', 'mngs', 'data', 'chikungunya', 'dengue infections', 'patients', 'bacterial infection', 'klebsiella pneumoniae', 'patient', 'differentiate', 'chikungunya', 'infections', 'dengue infections', 'clinical features', 'routine', 'non-diagnostic laboratory tests', 'early infection', 'full blood count', 'c-reactive protein level', 'phylogenetic analysis', 'chikungunya', 'sequences', 'study', 'sequenced', 'maldives', 'malaysia', 'india', 'singapore', 'chikungunya infection', 'masquerade', 'dengue', 'low-', 'middle-income', 'countries', 'dengue', 'treated', 'clinical suspicion', 'without', 'confirmatory testing', 'infections', 'complications', 'natural history', 'chikungunya', 'dengue infections', 'cheap', 'diagnostics', 'infections', 'endemic countries']","['India', 'Sri Lanka', 'Maldives', 'Malaysia', 'Singapore']"
40621243,Mumps Encephalitis in a Measles Rubella (MR)-Vaccinated Child: A Rare but Preventable Complication.,"Mumps is a vaccine-preventable disease caused by the mumps virus, mainly affecting the salivary glands. It can cause serious complications, including mumps encephalitis. Despite widespread immunization practices, mumps outbreaks persist among both vaccinated and unvaccinated populations, raising issues of concern regarding herd immunity. Mumps encephalitis, although rare, can produce serious complications warranting prompt diagnosis and management. Here, in this case report, we present a five-year-old girl who presented with fever, bilateral parotid swelling, and a single episode of abnormal movement in the form of dystonia associated with fixed gaze and disorientation. The patient had received two doses of the measles rubella (MR) vaccine as per India's universal immunization program (UIP). Laboratory investigations showed high amylase levels, positive serum mumps IgM, and cerebrospinal fluid pleocytosis; all indicative of mumps encephalitis. Brain imaging was normal, excluding other neurological causes. Initial empirical antibiotics and acyclovir were discontinued following the diagnosis of mumps encephalitis. The patient showed improvement within 48 hours of supportive treatment. This case highlights the importance of considering mumps encephalitis in pediatric patients with mumps showing neurological symptoms. It also demonstrates the public health impact of omitting the mumps vaccine from India's UIP and the major role of the mumps, measles, and rubella (MMR) vaccination in preventing such complications.",2025 Jun,"['mumps', 'vaccine-preventable disease', 'mumps virus', 'affecting', 'salivary glands', 'complications', 'mumps encephalitis', 'immunization practices', 'mumps outbreaks', 'vaccinated', 'unvaccinated populations', 'issues', 'herd immunity', 'mumps encephalitis', 'rare', 'complications', 'diagnosis', 'management', 'case report', 'girl', 'fever', 'bilateral', 'parotid swelling', 'episode', 'abnormal', 'movement', 'dystonia', 'associated with', 'fixed gaze', 'disorientation', 'patient', 'doses', 'measles rubella (mr) vaccine', ""india's"", 'immunization program', 'uip', 'laboratory investigations', 'amylase', 'positive', 'igm', 'cerebrospinal fluid pleocytosis', 'mumps encephalitis', 'brain imaging', 'neurological causes', 'empirical', 'antibiotics', 'acyclovir', 'discontinued', 'diagnosis', 'mumps encephalitis', 'patient', 'improvement', 'supportive treatment', 'mumps encephalitis', 'pediatric', 'patients', 'mumps', 'neurological symptoms', 'public health', 'impact', 'mumps vaccine', ""india's"", 'uip', 'mumps', 'measles', 'rubella', 'mmr', 'vaccination', 'preventing', 'complications']",['India']
40620198,Beyond the danger triangle: Septic cavernous sinus thrombosis following a temporal forehead furuncle.,"Septic cavernous sinus thrombosis (CST) is a rare but life-threatening complication of facial infections, typically arising from the midface 'danger triangle'. Rarely, lateral facial infections may also lead to CST through spread via deep venous pathways. We report a previously healthy adolescent boy who developed fever, bilateral orbital swelling, and painful ophthalmoplegia shortly after the resolution of a furuncle over the left temporal part of the forehead. Magnetic resonance imaging confirmed CST. He was treated with intravenous ceftriaxone, vancomycin, and low molecular weight heparin, resulting in clinical recovery. This case highlights the importance of considering CST even when the primary infection lies outside the classical anatomical danger zone.",2025 Jul 7,"['septic cavernous sinus thrombosis', 'cst', 'rare', 'life-threatening', 'complication', 'facial infections', 'midface', 'lateral facial infections', 'cst', 'spread', 'deep venous pathways', 'healthy', 'adolescent', 'boy', 'fever', 'bilateral', 'painful', 'ophthalmoplegia', 'resolution', 'furuncle', 'left temporal', 'forehead', 'magnetic resonance imaging', 'cst', 'treated with', 'intravenous ceftriaxone', 'vancomycin', 'low', 'molecular weight', 'heparin', 'clinical recovery', 'case', 'cst', 'primary infection', 'anatomical danger', 'zone']",[]
40617070,"Clinical Profile, Intensive Care Needs, and Short-Term Outcome of Acute Necrotizing Encephalopathy of Childhood: A Retrospective Study From a Tertiary Care Hospital in North India.","BACKGROUND: Acute necrotizing encephalopathy of childhood (ANEC) is a rare parainfectious clinicoradiological syndrome characterized by rapid neurological deterioration and poor outcomes. METHODS: We conducted a retrospective study over 11 years (2014-2024) in the pediatric emergency and intensive care units of a quaternary hospital in North India. Children aged one month to 12 years diagnosed with ANEC were enrolled. Data on demographics, clinical features, laboratory and neuroimaging findings, etiology, management, and outcomes were collected. The ANEC Severity Score (ANE-SS) was calculated. RESULTS: Thirty-two children were included (median age, 4 [interquartile range, 1-7] years; 53.1% male). Common clinical features included altered state of consciousness (96.9%), fever (93.7%), seizures (78.1%), and signs of raised intracranial pressure (46.9%). Organ dysfunctions included encephalopathy (100%), transaminitis (56.2%), and thrombocytopenia (46.9%). Neuroimaging revealed bilateral thalamic involvement in all cases. Etiology was identified in 37.5%, most commonly dengue virus (21.9%), followed by H1N1 (6.2%). Intensive care interventions included mechanical ventilation (56.2%) and vasoactive drugs (31.2%). Immunomodulatory therapy included methylprednisolone (78.1%), intravenous immunoglobulin (25%), and tocilizumab (15.6%). Survival rate was 78.1%. At discharge, the median Pediatric Cerebral Performance Category score was 3 (3-4), indicating moderate to severe disability. High-risk ANE-SS was significantly associated with mortality (P = 0.007). CONCLUSIONS: ANEC remains a severe pediatric encephalopathy with high neuromorbidity. Dengue virus was the most common trigger in this cohort. Early identification and intensive care support, along with immunomodulation, are key. ANE-SS may serve as a valuable prognostic tool.",2025 Jun 20,"['background', 'acute necrotizing encephalopathy of childhood', 'anec', 'rare', 'parainfectious clinicoradiological syndrome', 'characterized', 'neurological deterioration', 'poor outcomes', 'retrospective study', 'years', 'pediatric', 'emergency', 'intensive care units', 'quaternary hospital', 'north india', 'children', 'aged', 'month', 'years', 'diagnosed', 'anec', 'data', 'demographics', 'clinical features', 'laboratory', 'neuroimaging findings', 'etiology', 'management', 'outcomes', 'anec severity score', 'ane-ss', 'children', 'median age', 'interquartile range', 'years', 'male', 'clinical features', 'consciousness', 'fever', 'seizures', 'signs', 'intracranial pressure', 'organ dysfunctions', 'encephalopathy', 'transaminitis', 'thrombocytopenia', 'neuroimaging', 'bilateral', 'thalamic', 'involvement', 'cases', 'etiology', 'dengue virus', 'h1n1', 'intensive care interventions', 'mechanical ventilation', 'vasoactive drugs', 'immunomodulatory therapy', 'methylprednisolone', 'intravenous immunoglobulin', 'tocilizumab', 'survival rate', 'discharge', 'median', 'pediatric', 'cerebral performance', 'category score', 'moderate', 'severe', 'disability', 'high-risk', 'ane-ss', 'associated with', 'mortality', 'anec', 'pediatric', 'high', 'neuromorbidity', 'dengue virus', 'cohort', 'early identification', 'intensive care support', 'immunomodulation', 'ane-ss', 'prognostic tool']",['India']
40615133,Dengue cerebellitis in middle childhood from South India.,"We had a girl in middle childhood, who presented with fever of 7 days duration, vomiting, abdominal pain, headache, myalgia and arthralgia. The child was conscious with signs of shock. With the provisional diagnosis of dengue fever, enteric fever or scrub typhus, the child was given all supportive management. Lab investigations covering the fever panel were sent. Within 24 hours of admission, the child developed horizontal nystagmus, diplopia and intermittent dizziness. Fundus examination showed papilloedema. MRI brain showed hyperintensity of the cerebellum in T2 sections suggestive of cerebellitis. Dengue IgM antibody was positive with transaminitis and hyperferritinaemia. Child was given anti-oedema measures with supportive care. The patient recovered on day 10 of illness, and cerebellar signs subsided. Though dengue fever is commonly seen in tropical countries, the atypical presentation in the form of cerebellitis is found to be rare. The timely diagnosis helped in rapid recovery from this neurological manifestation.",2025 Jul 3,"['girl', 'middle childhood', 'fever', 'days', 'duration', 'vomiting', 'abdominal pain', 'headache', 'myalgia', 'arthralgia', 'child', 'conscious', 'signs of shock', 'provisional diagnosis', 'dengue fever', 'enteric fever', 'scrub typhus', 'child', 'supportive management', 'lab investigations', 'fever panel', 'admission', 'child', 'horizontal', 'nystagmus', 'diplopia', 'intermittent dizziness', 'fundus examination', 'papilloedema', 'mri', 'brain', 'hyperintensity', 'cerebellum', 'sections', 'cerebellitis', 'dengue', 'igm antibody', 'positive', 'transaminitis', 'hyperferritinaemia', 'child', 'anti-oedema measures', 'supportive care', 'patient', 'day', 'illness', 'cerebellar', 'signs', 'dengue fever', 'tropical countries', 'atypical', 'presentation', 'cerebellitis', 'rare', 'diagnosis', 'recovery', 'neurological', 'manifestation']",[]
40612792,Exploring the bioactive-based therapeutic and culinary potential of Madhuca longifolia flower and delineating the research gaps in terms of scientific validation.,"The flower of Madhuca longifolia (family Sapotaceae) has a long history of traditional use in treating fever, inflammation, rheumatism, ulcers, impotence, skin ailments and heart diseases across Southeast Asia. In India, the flower is commonly consumed as a regular food item and is also used as a tonic, appetizer, galactagogue and carminative agent, particularly among rural populations residing near plantations. There are ethnopharmacological claims about several therapeutic properties and antidiabetic activities of the flower, but no scientific evidence is available on this aspect. This review aims to explore the traditional, nutraceutical and pharmacological properties of M. longifolia flowers while identifying the research gaps for establishing its therapeutic use. A comprehensive literature search was conducted on Google Scholar, PubMed, ScienceDirect, ResearchGate, Scopus, and Web of Science from 2000 to 2025. Only research and review articles were considered for analysis. Our findings present that the major bioactive compounds identified in the flower include rutin, quercetin, Mi-saponin A & B, madhucoside A & B, gallic acid and ascorbic acid. In vitro studies indicate that it has strong antioxidant activity, while in-vivo studies on animal models document hepatoprotective, anti-dyslipidemic and antidepressant properties, but these studies are miniscule. Till date no clinical trials have been conducted on the therapeutic efficacy of the flower. Although the flower is naturally rich in several bioactive compounds, its potential therapeutic properties have not been scientifically validated. Focused research is needed to extract and quantify all the key bioactives of the flower. Additionally, studies involving human participants to assess the flower's therapeutic properties are needed to bridge the gap between traditional use and modern pharmacology.",2025 Aug,"['flower', 'madhuca longifolia', 'family sapotaceae', 'long history', 'treating', 'fever', 'inflammation', 'rheumatism', 'ulcers', 'impotence', 'skin ailments', 'heart diseases', 'southeast asia', 'india', 'flower', 'regular food item', 'tonic', 'appetizer', 'galactagogue', 'carminative agent', 'rural populations', 'near', 'plantations', 'ethnopharmacological claims', 'therapeutic', 'antidiabetic activities', 'flower', 'scientific evidence', 'aspect', 'review', 'traditional', 'nutraceutical', 'pharmacological', 'm. longifolia', 'flowers', 'research', 'therapeutic', 'comprehensive', 'literature', 'search', 'google scholar', 'pubmed', 'sciencedirect', 'researchgate', 'scopus', 'web of science', 'research', 'review', 'articles', 'analysis', 'findings', 'bioactive compounds', 'identified', 'flower', 'rutin', 'quercetin', 'mi-saponin a & b', 'madhucoside a & b', 'gallic acid', 'ascorbic acid', 'in vitro', 'studies', 'antioxidant activity', 'in-vivo', 'studies', 'animal models', 'hepatoprotective', 'anti-dyslipidemic', 'antidepressant', 'properties', 'studies', 'miniscule', 'clinical trials', 'therapeutic', 'efficacy', 'flower', 'flower', 'bioactive compounds', 'therapeutic', 'scientifically validated', 'focused research', 'extract', 'quantify', 'bioactives', 'flower', 'studies', 'human', 'participants', ""flower's"", 'therapeutic', 'gap', 'modern pharmacology']",['India']
