PMID,Title,Abstract,Date,Entities,Countries
40747162,Methicillin-Resistant Staphylococcus aureus Renal Abscess Unmasks Human Immunodeficiency Virus Infection in an Adolescent: A Case Report.,"Renal abscesses are rare in children. This report presents a case where a renal abscess due to methicillin-resistant Staphylococcus aureus (MRSA) was the initial indication of immunocompromised status in an adolescent boy. A 17-year-old male patient presented with a month-long history of fever, fatigue, and significant weight loss, along with dull aches and swelling in the left flank. There was no history of urinary symptoms, vomiting, or high-risk behaviors. His mother had died from sepsis while on antiretroviral therapy (ART), and his father from coronary artery disease. The patient had not been previously tested for human immunodeficiency virus (HIV). Examination revealed a tender fullness in the left lumbar region. Ultrasound showed a collection in the left kidney. Blood tests indicated anemia and elevated inflammatory markers. The patient tested positive for HIV antibodies. Empirical antibiotics were started. Ultrasound-guided aspiration grew MRSA, prompting a switch to vancomycin. A percutaneous catheter was inserted due to abscess recurrence. The patient received intravenous vancomycin followed by oral linezolid and started antiretroviral therapy. Repeat imaging at six weeks showed resolution of the abscess. Renal abscesses in children can be life-threatening and often result from urinary tract infections or hematogenous spread. This patient's abscess likely resulted from hematogenous spread due to immunocompromised status. Effective management, including prompt percutaneous drainage and targeted antibiotics, combined with ART, led to abscess resolution and a favorable outcome. This case underscores the importance of considering immunodeficiency in pediatric patients with unusual infections like renal abscesses and highlights the necessity of a multidisciplinary approach and aggressive management for complex infections in immunocompromised children.",2025 Jul,"['renal abscesses', 'children', 'report', 'case', 'renal abscess', 'methicillin-resistant staphylococcus aureus', 'mrsa', 'indication', 'immunocompromised status', 'adolescent', 'boy', 'male', 'patient', 'month-long history', 'fever', 'fatigue', 'significant', 'weight loss', 'dull aches', 'swelling', 'left flank', 'urinary symptoms', 'vomiting', 'high-risk behaviors', 'mother', 'died', 'sepsis', 'antiretroviral therapy', 'art', 'father', 'coronary artery disease', 'patient', 'human immunodeficiency virus', 'hiv', 'examination', 'tender fullness', 'left lumbar region', 'ultrasound', 'collection', 'left kidney', 'blood tests', 'anemia', 'elevated', 'inflammatory', 'markers', 'patient', 'positive', 'hiv antibodies', 'empirical', 'antibiotics', 'ultrasound-guided', 'aspiration', 'mrsa', 'switch', 'vancomycin', 'percutaneous catheter', 'abscess', 'recurrence', 'patient', 'intravenous', 'oral', 'linezolid', 'started', 'antiretroviral therapy', 'imaging', 'weeks', 'resolution', 'abscess', 'renal abscesses', 'children', 'life-threatening', 'urinary tract infections', 'hematogenous', 'spread', ""patient's"", 'abscess', 'hematogenous', 'spread', 'immunocompromised status', 'effective management', 'percutaneous drainage', 'targeted antibiotics', 'combined', 'art', 'abscess', 'resolution', 'favorable outcome', 'immunodeficiency', 'pediatric', 'patients', 'infections', 'renal abscesses', 'multidisciplinary approach', 'aggressive management', 'complex infections', 'immunocompromised children']",[]
40746790,Diverse Manifestations of Central Nervous System Tuberculosis: Magnetic Resonance Imaging (MRI) Presentations and Laboratory Investigations in a Cohort Study.,"OBJECTIVES: This study aims to evaluate and characterize the diverse MRI findings in central nervous system (CNS) tuberculosis (TB) and the role of other laboratory investigations to aid in early detection and appropriate management. MATERIALS AND METHODS: This retrospective, cross-sectional study analyzed clinical and imaging data from 43 patients with confirmed CNS TB. The diagnosis was confirmed through cerebrospinal fluid (CSF) analysis, biopsy, or clinical and radiological improvement post-antitubercular therapy (ATT). MRI findings were categorized into meningeal and parenchymal forms, with further subtyping based on lesion characteristics. Chi-square statistics were performed using IBM SPSS Statistics for Windows, version 27 (IBM Corp., Armonk, New York, United States) to correlate CNS TB with clinical parameters.  Results: The mean age of the 43 patients was 33 years, and 58% were male. The most common clinical symptoms were headache (86%) and fever (79%). MRI findings revealed meningeal TB (leptomeningitis and pachymeningitis) and parenchymal TB (tuberculomas, tubercular abscesses, cerebritis, rhombencephalitis, and encephalopathy). Frequent observations included ring-enhancing lesions and perilesional edema. Parenchymal tuberculomas showed varying stages. Advanced imaging techniques such as magnetic resonance spectroscopy and perfusion imaging were useful in differentiating tuberculomas from neoplastic and infectious differentials. CONCLUSION: CNS TB presents with diverse MRI patterns, including both typical and atypical manifestations. Accurate radiological assessment, combined with clinical correlation, is essential for early diagnosis and management. Prompt initiation of ATT is critical in preventing long-term neurological complications. Future research should focus on refining imaging biomarkers to improve diagnostic accuracy.",2025 Jun,"['objectives', 'study', 'evaluate', 'characterize', 'diverse', 'mri', 'findings', 'central nervous system', 'laboratory investigations', 'early detection', 'appropriate', 'management', 'retrospective', 'cross-sectional study', 'clinical', 'imaging', 'data', 'patients', 'cns tb', 'diagnosis', 'cerebrospinal fluid', 'csf', 'biopsy', 'clinical', 'radiological', 'post-antitubercular therapy', 'att', 'mri', 'findings', 'meningeal', 'parenchymal forms', 'subtyping', 'lesion', 'characteristics', 'chi-square statistics', 'ibm spss statistics', 'windows', 'armonk', 'new york', 'united states', 'cns', 'clinical', 'parameters', 'age', 'patients', 'years', 'male', 'clinical symptoms', 'headache', 'fever', 'mri', 'findings', 'meningeal tb', 'leptomeningitis', 'pachymeningitis', 'parenchymal tb', 'tuberculomas', 'tubercular abscesses', 'cerebritis', 'rhombencephalitis', 'encephalopathy', 'frequent', 'observations', 'ring-enhancing lesions', 'perilesional edema', 'parenchymal tuberculomas', 'stages', 'advanced imaging techniques', 'magnetic resonance spectroscopy', 'perfusion imaging', 'tuberculomas', 'neoplastic', 'infectious differentials', 'cns', 'diverse', 'mri', 'patterns', 'typical', 'atypical', 'manifestations', 'radiological assessment', 'clinical correlation', 'early diagnosis', 'management', 'prompt', 'initiation', 'att', 'long-term', 'neurological complications', 'research', 'imaging', 'biomarkers', 'diagnostic accuracy']",['United States']
40742524,Anti-chikungunya Activity of a Cinnamic Acid Derivative: An In Vitro and In Silico Study.,"Chikungunya virus (CHIKV) is an arthropod-borne virus that causes debilitating joint pain and fever with limited treatment options. Cinnamic acid, known for its broad-spectrum biological activities, and its derivatives were evaluated for their potential antiviral effects against CHIKV. In vitro experiments assessed the cytotoxicity of cinnamic acid and its derivatives and their efficacy in inhibiting CHIKV under different treatment settings. Additionally, molecular docking of the effective compounds with CHIKV proteins was performed to determine the probable targets. The results indicated that the derivative CATD-3, a 3,6-(substituted phenyl)-(1,2,4) triazolo [3,4-b][1,3,4] thiadiazole compound, showed antiviral activity under post-infection treatment conditions in Vero CCL-81 cells. The dose-dependent studies revealed that the 50% inhibitory concentration (IC50) was 11.49 microM and the selectivity index of CATD-3 was 13.39. The antiviral activity of CATD-3 was also observed in HeLa cells. In-silico studies revealed that the CATD-3 binds multiple non-structural proteins (nsP) i.e., nsP1, nsP2, and nsP4 of the virus with good binding energies and forming strong interactions with conserved residues on nsP1 methyl transferase (Val 129, Tyr 130, Ala 131) and nsP2 helicase (Met 91, Met 289, and Thr 261) and critical residues of the nsP4 RdRp (Arg331 and Asp 350). The combined in vitro and in silico studies underscores the therapeutic potential of cinnamic acid derivative, CATD-3, as a promising antiviral candidate against CHIKV.",2025 Jul 31,"['chikungunya virus', 'chikv', 'arthropod-borne virus', 'debilitating', 'joint pain', 'fever', 'treatment options', 'cinnamic acid', 'broad-spectrum biological activities', 'derivatives', 'evaluated', 'potential', 'antiviral effects', 'chikv', 'in vitro', 'experiments', 'assessed', 'cytotoxicity', 'cinnamic acid', 'derivatives', 'efficacy', 'inhibiting', 'chikv', 'treatment settings', 'molecular docking', 'effective', 'compounds', 'chikv', 'proteins', 'targets', 'results', 'derivative', 'catd-3', '3,6-(substituted phenyl)-(1,2,4) triazolo', 'antiviral activity', 'post-infection', 'treatment conditions', 'vero ccl-81 cells', 'dose-dependent', 'inhibitory', 'ic50', 'selectivity index', 'catd-3', 'antiviral activity', 'catd-3', 'hela', 'cells', 'in-silico studies', 'catd-3', 'binds', 'multiple', 'nsp1', 'nsp2', 'nsp4', 'virus', 'binding energies', 'interactions', 'conserved residues', 'nsp1 methyl transferase', 'tyr', 'ala 131)', 'nsp2 helicase', 'met', 'met', 'thr', 'critical residues', 'nsp4 rdrp', 'arg331', 'asp', 'in vitro', 'in silico studies', 'therapeutic', 'potential', 'cinnamic acid derivative', 'catd-3', 'antiviral candidate', 'chikv']",[]
40742003,Paradoxical Hemoglobin Drop Post-Transfusion: Hyperhemolysis in Delta-Beta Thalassemia with Macrophage Activation Syndrome.,"Hyperhaemolysis syndrome (HHS) is a rare, severe complication of transfusion characterised by a paradoxical drop in haemoglobin (Hb) levels post-transfusion, often below pre-transfusion values. Most reported cases are in patients with sickle cell disease and it has been rarely reported in other haemoglobinopathies. We report a case of HHS in a newly diagnosed delta-beta thalassaemia patient, manifesting as macrophage activation syndrome (MAS), successfully managed with intravenous immunoglobulin (IVIG), corticosteroids, rituximab, and erythropoietin. A 19-year-old female presented with fever, jaundice, and hepatosplenomegaly three weeks after a blood transfusion. Investigations revealed microcytic anaemia, elevated LDH and indirect bilirubin, and HPLC findings suggestive of delta-beta thalassaemia. She developed haemolysis and a paradoxical Hb drop after subsequent transfusions, along with reticulocytopenia. Alloimmunisation was initially absent but anti-E and anti-K antibodies were subsequently detected. Despite antigen-matched transfusions, haemolysis persisted, raising suspicion for HHS. She was managed with IVIG, methylprednisolone, erythropoietin, and rituximab, resulting in initial improvement in haemoglobin levels, which subsequently declined again. She then developed fever and leukocytosis without evidence of infection, and a high HScore raised suspicion for macrophage activation syndrome (MAS). Dexamethasone was initiated, leading to defervescence, normalisation of the reticulocyte count, and a significant rise in haemoglobin. She was discharged in stable condition and remained well at 6-month follow-up. This case highlights hyperhaemolysis syndrome (HHS) as a potential complication in patients with haemoglobinopathies. Although its exact pathogenesis remains unclear, macrophage activation appears to play an important role. Early recognition and timely initiation of appropriate immunotherapy can lead to favourable outcomes.",2025 Jul 31,"['hyperhaemolysis syndrome', 'hhs', 'rare', 'severe', 'complication', 'transfusion', 'characterised', 'paradoxical', 'haemoglobin', 'post-transfusion', 'pre-transfusion', 'cases', 'patients', 'sickle cell disease', 'haemoglobinopathies', 'case', 'hhs', 'diagnosed', 'delta-beta thalassaemia', 'patient', 'manifesting', 'macrophage activation syndrome', 'mas', 'intravenous immunoglobulin (', 'ivig', 'corticosteroids', 'rituximab', 'erythropoietin', 'female', 'fever', 'jaundice', 'hepatosplenomegaly', 'weeks', 'blood transfusion', 'investigations', 'microcytic anaemia', 'elevated', 'ldh', 'indirect', 'bilirubin', 'hplc', 'findings', 'delta-beta thalassaemia', 'haemolysis', 'paradoxical', 'drop', 'transfusions', 'reticulocytopenia', 'alloimmunisation', 'absent', 'anti-e', 'anti-k', 'antibodies', 'detected', 'antigen-matched transfusions', 'haemolysis', 'suspicion', 'hhs', 'ivig', 'methylprednisolone', 'erythropoietin', 'rituximab', 'improvement', 'haemoglobin', 'levels', 'declined', 'fever', 'leukocytosis', 'evidence', 'infection', 'hscore', 'suspicion', 'macrophage activation syndrome', 'mas', 'dexamethasone', 'defervescence', 'normalisation', 'reticulocyte', 'significant', 'haemoglobin', 'discharged', 'stable', 'condition', 'follow-up', 'hyperhaemolysis syndrome', 'hhs', 'complication', 'patients', 'haemoglobinopathies', 'pathogenesis', 'unclear', 'macrophage', 'early recognition', 'initiation', 'immunotherapy']",['Mali']
40741554,Clinico-Epidemiological Profile of Dengue in Children of Age Group 0-14 Years Admitted in a Tertiary Care Hospital.,"Background Dengue has emerged as the most common arboviral infection in India and worldwide. Dengue presents with a varied clinical spectrum in different age groups. The changing epidemiology and presentation are a challenge for early diagnosis and management. This prospective observational study aimed to determine the epidemiological profile of hospitalized dengue-positive children aged 0-14 years and correlate their clinical and hematological profiles. Methodology One hundred and five children with laboratory-confirmed dengue were enrolled in this study over a six-month study period. They were categorized into severe and non-severe dengue according to the World Health Organization (WHO) classification. Detailed clinical examination and laboratory investigations, including complete blood count, liver enzymes, coagulation profile, and imaging (chest X-ray and abdominal ultrasound), were performed. Data were analyzed using descriptive statistics, chi-square test, and logistic regression analysis. Results Out of the total 105 cases, 90 children (85.7%) had non-severe dengue and only 15 (14.3%) had severe dengue. The mean age of children was 92.02 months, with a male predominance (72, 68.6%). The most commonly identified symptoms were fever (105, 100%), vomiting (47, 44.76%), and abdominal pain (46, 43.81%). It was found that although thrombocytopenia was seen in 79 children (75.2%), it was not significantly associated with the severity of the disease (P = 0.2364). The study found a high recovery rate (101, 96.3%) with a mortality of 3 patients (2.8%) in severe cases. Elevated serum glutamate pyruvate transaminase (SGPT) levels (P = 0.0025), pleural effusion on chest X-ray (P = 0.000452), abdominal pain (P = 0.0041), and a positive tourniquet test (P < 0.0001) were found to be significantly associated with severe dengue. Non-structural protein 1 (NS1) antigen and immunoglobulin M (IgM) antibodies were both found to be positive more frequently in severe cases compared to non-severe cases (P = 0.0361). Conclusions This study observed a high rate of recovery and low mortality, owing to the timely management. A possible shift in the seasonal distribution of dengue was observed, with many cases occurring in the winter season. While thrombocytopenia was prevalent, it was not found to be significantly associated with disease severity or bleeding. On the other hand, elevated liver enzymes, pleural effusion, abdominal pain, and a positive tourniquet test were found to be more strongly associated with severe dengue. They may serve as valuable early clinical indicators for the severity of the disease.",2025 Jun,"['background', 'dengue', 'arboviral infection', 'india', 'worldwide', 'dengue', 'clinical spectrum', 'age groups', 'changing', 'epidemiology', 'presentation', 'early diagnosis', 'management', 'prospective observational study', 'epidemiological profile', 'hospitalized dengue-positive', 'children', 'aged', 'years', 'correlate', 'clinical', 'hematological profiles', 'methodology', 'children', 'laboratory-confirmed', 'dengue', 'study', 'study', 'severe', 'non-severe', 'dengue', 'world health organization', 'classification', 'clinical examination', 'laboratory investigations', 'complete blood count', 'liver enzymes', 'coagulation profile', 'imaging', 'chest x-ray', 'abdominal ultrasound', 'data', 'analyzed', 'chi-square test', 'logistic regression analysis', 'cases', 'children', 'non-severe', 'dengue', 'severe', 'dengue', 'age', 'children', 'months', 'male', 'predominance', 'identified', 'symptoms', 'fever', 'vomiting', 'abdominal pain', 'thrombocytopenia', 'children', 'associated with', 'severity', 'disease', 'study', 'mortality', 'patients', 'severe', 'cases', 'elevated', 'serum', 'glutamate pyruvate transaminase', 'levels', 'pleural effusion', 'chest x-ray', 'abdominal pain', 'positive tourniquet test', 'associated with', 'severe', 'dengue', 'non-structural protein 1', 'immunoglobulin m', 'igm', 'antibodies', 'positive', 'severe', 'cases', 'non-severe', 'cases', 'study', 'rate', 'recovery', 'low', 'mortality', 'management', 'seasonal distribution', 'dengue', 'cases', 'winter', 'season', 'thrombocytopenia', 'associated with', 'disease severity', 'bleeding', 'elevated', 'liver enzymes', 'pleural effusion', 'abdominal pain', 'positive tourniquet test', 'associated with', 'severe', 'dengue', 'clinical indicators', 'severity', 'disease']",['India']
40739540,Study of rheumatoid arthritis in older patients: a cross-sectional study.,"BACKGROUND: Rheumatoid Arthritis (RA) in older adults is a chronic inflammatory condition causing severe disability and impacting patients' physical, psychological, and social health. It lowers productivity in society and puts pressure on healthcare systems. This study aims to explore the different aspects of RA and investigate the diagnostic potential of serum marker 14-3-3eta. METHOD: This Cross-sectional study recruited 205 arthritis patients (63 RA and 142 OA) over sixty years old. The participants underwent a thorough clinical evaluation according to the established design. Anti-CCP and serum 14-3-3eta levels were measured. Simple logistic regression was performed to identify significant predictors of RA. ROC curve determined optimal cut-off value for 14-3-3eta. RESULTS: This study reported an average age of 63.67 years with a high female-to-male ratio of 4:1 in the RA cohort, while in the OA cohort, the mean age was 65.5 years with a low female-to-male ratio of 2:1 overall. Symptomatically, RA patients exhibited earlier onset, pronounced early morning stiffness, fever, weight loss, myalgia, and fatigue, all with highly significant p-values (< 0.001). Comorbidities showed higher incidences of anemia, ILD, and osteoporosis in RA patients. Impaired ADL and IADL were noted in 17.5% and 73.2%, respectively. Impaired HMSE and GDS were found in 36.5% and 74.6%, respectively. Logistic regression analysis identified key predictors distinguishing RA from OA, including EMS (OR: 1.09, p < 0.001), fever (OR: 6.68, p < 0.001), weight loss (OR: 6.35, p < 0.001), myalgia (OR: 5.07, p < 0.001), osteoporosis (OR: 2.21, p = 0.013), ACCP levels (OR: 1.28, p < 0.001), and the novel marker 14-3-3eta (OR: 2.87, p = 0.047). Using both ACCP and14-3-3eta markers, 88.88% of RA patients were positive for at least one marker, enhancing its diagnostic coverage. Elderly onset RA (EORA) patients had a significantly higher age and shorter disease duration compared to those with young onset RA (YORA). The female-to-male ratio in the YORA and EORA group were 6.97:1 and 1.66:1 respectively. PMR-like symptoms were more prevalent in the EORA group (31.25% vs.14.9%). Hypothyroidism was more frequent in the EORA group (31% vs. 17%). Sulfasalazine was more commonly prescribed in both EORA (100%) and YORA (89%) groups. CONCLUSION: This study contributes to a better understanding of distinguishing RA from OA. It also highlights the differences between young and elderly onset RA, and supports the diagnostic potential of the serum marker 14-3-3eta.",2025 Jul 30,"['background', 'rheumatoid arthritis', 'older adults', 'chronic', 'severe', 'disability', ""patients'"", 'physical', 'psychological', 'social health', 'productivity', 'society', 'pressure', 'healthcare systems', 'study', 'investigate', 'diagnostic', 'potential', 'serum marker', 'cross-sectional study', 'arthritis', 'patients', 'years', 'participants', 'clinical evaluation', 'design', 'anti-ccp', 'serum', 'levels', 'measured', 'logistic regression', 'predictors', 'roc curve', 'optimal', 'cut-off value', 'study', 'average', 'age', 'years', 'female-to-male ratio', 'cohort', 'cohort', 'age', 'years', 'low', 'female-to-male ratio', 'overall', 'symptomatically', 'patients', 'stiffness', 'fever', 'weight loss', 'myalgia', 'fatigue', 'p-values', 'comorbidities', 'incidences', 'anemia', 'ild', 'osteoporosis', 'patients', 'impaired', 'adl', 'iadl', 'impaired', 'hmse', 'gds', 'logistic regression analysis', 'predictors', 'ems', 'fever', 'weight loss', 'myalgia', 'osteoporosis', 'accp', 'levels', 'novel', 'marker', 'accp', 'markers', 'patients', 'positive', 'marker', 'diagnostic coverage', 'elderly onset ra', 'eora', 'patients', 'significantly higher', 'age', 'shorter', 'compared', 'young onset ra', 'yora', 'female-to-male ratio', 'yora', 'eora', 'group', '1.66:1', 'pmr-like', 'symptoms', 'prevalent', 'eora', 'group', 'hypothyroidism', 'frequent', 'eora', 'group', 'sulfasalazine', 'prescribed', 'eora', 'yora', 'groups', 'study', 'young', 'elderly', 'diagnostic', 'potential', 'serum marker']",[]
40739406,Efficacy of probiotics in reducing the duration and severity of acute gastroenteritis in children: A meta-analysis of randomized controlled trials.,"OBJECTIVES: Acute gastroenteritis is a leading global health concern among children, causing significant morbidity and mortality. Despite advances in treatment, effective management remains a challenge. Probiotics aim to restore gut homeostasis by correcting intestinal dysbiosis. This systematic review and meta-analysis aims to assess the efficacy of probiotics in reducing the severity and duration of diarrhea in children with acute gastroenteritis. METHODS: A comprehensive literature search was conducted across four major databases using the keywords ""acute diarrhea,"" ""pediatric,"" and ""probiotics,"" among others. Only double-arm randomized clinical trials (RCTs) were included, focusing on the efficacy of probiotics in treating pediatric acute diarrhea. Data analysis was performed using Stata 16.0, with a random-effects model applied to account for study variability. RESULTS: Out of 1470 studies screened, 25 RCTs involving 5170 patients (2552 in the probiotic group and 2618 in the placebo group) met the inclusion criteria. Probiotics significantly reduced the overall duration of diarrhea (mean difference [MD]: -7.76; 95% confidence interval [CI]: -14.60 to -0.91; p = 0.03). Diarrhea frequency was notably reduced on Day 2 (MD: -1.03; 95% CI: -2.06 to 0.00; p = 0.05) and Day 5 (MD: -0.51; 95% CI: -0.83 to -0.18; p = 0.002). Probiotics also significantly reduced the duration of vomiting (MD: -0.19; 95% CI: -0.28 to -0.09; p < 0.01), with a nonsignificant trend in fever reduction. CONCLUSION: This meta-analysis demonstrates the clinical efficacy of probiotics in reducing the duration of diarrhea and vomiting in children with acute gastroenteritis. Future trials are recommended to further explore the role of specific probiotic strains and combinations to enhance treatment outcomes.",2025 Jul 30,"['objectives', 'acute gastroenteritis', 'global health', 'children', 'morbidity', 'mortality', 'treatment', 'effective', 'management', 'probiotics', 'restore', 'gut homeostasis', 'intestinal', 'dysbiosis', 'systematic review', 'meta-analysis', 'efficacy', 'probiotics', 'reducing', 'severity', 'duration', 'children', 'acute gastroenteritis', 'comprehensive', 'literature', 'search', 'databases', 'keywords', 'pediatric', 'probiotics', 'randomized clinical trials', 'rcts', 'efficacy', 'probiotics', 'treating', 'pediatric', 'data analysis', 'stata', 'random-effects model', 'study', 'variability', 'studies', 'screened', 'rcts', 'patients', 'probiotic', 'group', 'placebo', 'group', 'inclusion criteria', 'probiotics', 'duration of diarrhea', 'mean difference', 'confidence interval', 'diarrhea', 'frequency', 'reduced', 'day 2', 'day 5', 'probiotics', 'reduced', 'duration of vomiting', 'fever', 'reduction', 'meta-analysis', 'clinical efficacy', 'probiotics', 'reducing', 'duration', 'vomiting', 'children', 'acute gastroenteritis', 'trials', 'probiotic', 'strains', 'combinations', 'treatment outcomes']",[]
